{
  "formatVersion": 1,
  "kind": "EXECUTION_RESULT",
  "contract": "ksql-flow.execution/v1",
  "correlationId": "netrun_20260829_001",
  "attemptId": "attempt_20260829_001_A_001",
  "executionId": "ksqlrun_20260829_001",
  "jobId": "aggregate_customer",
  "profile": "prod",
  "status": "SUCCESS",
  "resultCode": "OK",
  "executionStarted": true,
  "exitCode": 0,
  "asOf": "2026-08-01T00:00:00+09:00",
  "startedAt": "2026-08-29T08:00:00.000Z",
  "finishedAt": "2026-08-29T08:02:00.000Z",
  "durationMs": 120000,
  "readCount": 30000,
  "writtenCount": 30000,
  "deletedCount": 0,
  "apiCalls": 650,
  "lastSuccessfulChunkNo": 300,
  "lastWrittenKey": "C030000",
  "ksqlFlowVersion": "0.x.y",
  "engineVersion": "3.x.y",
  "error": null
}
